{
  "$schema": "https://json-schema.org/draft/2020-12/schema",
  "$id": "evidence-bundle.schema.json",
  "title": "Evidence Bundle",
  "description": "A complete, immutable evidence package assembled for every automated remediation action. The bundle must be created BEFORE execution (pre-execution fields) and completed AFTER execution (post-execution fields). This is the primary audit artefact for governance, compliance, and post-incident review.",
  "type": "object",
  "properties": {
    "bundle_id": {
      "type": "string",
      "description": "Unique identifier for this evidence bundle"
    },
    "incident_id": {
      "type": "string",
      "description": "Linked ITSM incident record"
    },
    "change_id": {
      "type": ["string", "null"],
      "description": "Linked change record, if a change was raised"
    },
    "traceparent": {
      "type": "string",
      "description": "W3C traceparent for distributed tracing correlation"
    },
    "created_at": {
      "type": "string",
      "format": "date-time"
    },
    "completed_at": {
      "type": ["string", "null"],
      "format": "date-time"
    },
    "pre_execution": {
      "type": "object",
      "description": "Evidence assembled BEFORE any tool execution",
      "properties": {
        "signal_context": {
          "type": "object",
          "description": "Original alert/event data that triggered the pipeline",
          "properties": {
            "source": { "type": "string" },
            "alert_id": { "type": "string" },
            "severity": { "type": "string" },
            "timestamp": { "type": "string", "format": "date-time" },
            "raw_payload_ref": { "type": "string", "description": "URI to raw alert payload" }
          },
          "required": ["source", "alert_id", "timestamp"]
        },
        "service_context": {
          "type": "object",
          "description": "Service and CI information from CMDB/service map",
          "properties": {
            "service": { "type": "string" },
            "service_owner": { "type": "string" },
            "tier": { "type": "string" },
            "dependencies": { "type": "array", "items": { "type": "string" } },
            "environment": { "type": "string" }
          },
          "required": ["service"]
        },
        "diagnostics_summary": {
          "type": "object",
          "description": "Diagnostics agent output: hypotheses and supporting evidence",
          "properties": {
            "probable_cause": { "type": "string" },
            "confidence": { "type": "number", "minimum": 0, "maximum": 1 },
            "supporting_evidence": { "type": "array", "items": { "type": "string" } },
            "telemetry_refs": { "type": "array", "items": { "type": "string" } }
          },
          "required": ["probable_cause", "confidence"]
        },
        "remediation_plan": {
          "type": "object",
          "description": "The proposed remediation plan as generated by the planner agent",
          "properties": {
            "steps": { "type": "array", "items": { "type": "string" } },
            "tools_required": { "type": "array", "items": { "type": "string" } },
            "estimated_duration_seconds": { "type": "integer" },
            "blast_radius": {
              "type": "object",
              "properties": {
                "services_affected": { "type": "integer" },
                "estimated_users_impacted": { "type": "integer" }
              }
            }
          },
          "required": ["steps", "tools_required"]
        },
        "policy_decision": {
          "$ref": "policy-decision.schema.json"
        },
        "rollback_plan": {
          "type": "object",
          "description": "Pre-defined rollback steps if execution fails validation",
          "properties": {
            "steps": { "type": "array", "items": { "type": "string" } },
            "rollback_tools": { "type": "array", "items": { "type": "string" } },
            "estimated_duration_seconds": { "type": "integer" }
          },
          "required": ["steps"]
        }
      },
      "required": ["signal_context", "service_context", "diagnostics_summary", "remediation_plan", "policy_decision", "rollback_plan"]
    },
    "post_execution": {
      "type": ["object", "null"],
      "description": "Evidence collected AFTER tool execution. Null if execution was denied or not yet completed.",
      "properties": {
        "execution_log": {
          "type": "object",
          "properties": {
            "execution_id": { "type": "string" },
            "tool_calls": {
              "type": "array",
              "items": {
                "type": "object",
                "properties": {
                  "tool": { "type": "string" },
                  "input": { "type": "object" },
                  "output": { "type": "object" },
                  "exit_status": { "type": "string", "enum": ["PLANNED", "SUCCESS", "FAILED", "ROLLED_BACK"] },
                  "started_at": { "type": "string", "format": "date-time" },
                  "ended_at": { "type": "string", "format": "date-time" }
                },
                "required": ["tool", "exit_status"]
              }
            },
            "raw_logs_ref": { "type": "string" }
          },
          "required": ["execution_id", "tool_calls"]
        },
        "validation_results": {
          "$ref": "validation-result.schema.json"
        },
        "rollback_results": {
          "type": ["object", "null"],
          "description": "Present only if rollback was triggered",
          "properties": {
            "triggered": { "type": "boolean" },
            "reason": { "type": "string" },
            "rollback_execution_id": { "type": "string" },
            "rollback_status": { "type": "string", "enum": ["SUCCESS", "FAILED", "PARTIAL"] }
          }
        }
      },
      "required": ["execution_log", "validation_results"]
    }
  },
  "required": ["bundle_id", "incident_id", "created_at", "pre_execution"]
}
